{
  "artifactVersion": "s12.dense-hard.gold.v3",
  "goldDigest": "sha256:5191d1b7ee0d4407d58cecac19b2d4127155c41cc608151aabfd65380cb9c0dc",
  "records": [
    {
      "caseId": "dh3-001",
      "expected": {
        "abstentionMode": "none",
        "abstentionReason": null,
        "entities": [
          {
            "entityId": "v3-001-e1",
            "evidence": {
              "endOffset": 14,
              "startOffset": 0,
              "text": "Aster workflow"
            },
            "label": "Aster workflow",
            "occurrenceKey": "dh3-001#workflow#1",
            "type": "Task"
          },
          {
            "entityId": "v3-001-e2",
            "evidence": {
              "endOffset": 40,
              "startOffset": 24,
              "text": "bronze checklist"
            },
            "label": "bronze checklist",
            "occurrenceKey": "dh3-001#checklist#1",
            "type": "Requirement"
          },
          {
            "entityId": "v3-001-e3",
            "evidence": {
              "endOffset": 58,
              "startOffset": 42,
              "text": "bronze checklist"
            },
            "label": "bronze checklist",
            "occurrenceKey": "dh3-001#checklist#2",
            "type": "Requirement"
          },
          {
            "entityId": "v3-001-e4",
            "evidence": {
              "endOffset": 80,
              "startOffset": 69,
              "text": "harbor seal"
            },
            "label": "harbor seal",
            "occurrenceKey": "dh3-001#seal#1",
            "type": "Control"
          }
        ],
        "quarantineCount": 0,
        "relations": [
          {
            "evidence": {
              "endOffset": 40,
              "startOffset": 0,
              "text": "Aster workflow requires bronze checklist"
            },
            "predicate": "requires",
            "relationId": "v3-001-r1",
            "sourceEntityId": "v3-001-e1",
            "targetEntityId": "v3-001-e2",
            "triggerEvidence": {
              "endOffset": 23,
              "startOffset": 15,
              "text": "requires"
            }
          },
          {
            "evidence": {
              "endOffset": 80,
              "startOffset": 42,
              "text": "bronze checklist validates harbor seal"
            },
            "predicate": "validates",
            "relationId": "v3-001-r2",
            "sourceEntityId": "v3-001-e3",
            "targetEntityId": "v3-001-e4",
            "triggerEvidence": {
              "endOffset": 68,
              "startOffset": 59,
              "text": "validates"
            }
          }
        ]
      }
    },
    {
      "caseId": "dh3-002",
      "expected": {
        "abstentionMode": "none",
        "abstentionReason": null,
        "entities": [
          {
            "entityId": "v3-002-e1",
            "evidence": {
              "endOffset": 13,
              "startOffset": 0,
              "text": "Cinder engine"
            },
            "label": "Cinder engine",
            "occurrenceKey": "dh3-002#engine#1",
            "type": "System"
          },
          {
            "entityId": "v3-002-e2",
            "evidence": {
              "endOffset": 36,
              "startOffset": 25,
              "text": "meadow rule"
            },
            "label": "meadow rule",
            "occurrenceKey": "dh3-002#rule#1",
            "type": "Requirement"
          },
          {
            "entityId": "v3-002-e3",
            "evidence": {
              "endOffset": 49,
              "startOffset": 38,
              "text": "meadow rule"
            },
            "label": "meadow rule",
            "occurrenceKey": "dh3-002#rule#2",
            "type": "Requirement"
          },
          {
            "entityId": "v3-002-e4",
            "evidence": {
              "endOffset": 75,
              "startOffset": 61,
              "text": "ferry schedule"
            },
            "label": "ferry schedule",
            "occurrenceKey": "dh3-002#schedule#1",
            "type": "Resource"
          }
        ],
        "quarantineCount": 0,
        "relations": [
          {
            "evidence": {
              "endOffset": 36,
              "startOffset": 0,
              "text": "Cinder engine implements meadow rule"
            },
            "predicate": "implements",
            "relationId": "v3-002-r1",
            "sourceEntityId": "v3-002-e1",
            "targetEntityId": "v3-002-e2",
            "triggerEvidence": {
              "endOffset": 24,
              "startOffset": 14,
              "text": "implements"
            }
          },
          {
            "evidence": {
              "endOffset": 75,
              "startOffset": 38,
              "text": "meadow rule constrains ferry schedule"
            },
            "predicate": "constrains",
            "relationId": "v3-002-r2",
            "sourceEntityId": "v3-002-e3",
            "targetEntityId": "v3-002-e4",
            "triggerEvidence": {
              "endOffset": 60,
              "startOffset": 50,
              "text": "constrains"
            }
          }
        ]
      }
    },
    {
      "caseId": "dh3-003",
      "expected": {
        "abstentionMode": "none",
        "abstentionReason": null,
        "entities": [
          {
            "entityId": "v3-003-e1",
            "evidence": {
              "endOffset": 13,
              "startOffset": 0,
              "text": "Dune register"
            },
            "label": "Dune register",
            "occurrenceKey": "dh3-003#register#1",
            "type": "Dataset"
          },
          {
            "entityId": "v3-003-e2",
            "evidence": {
              "endOffset": 34,
              "startOffset": 21,
              "text": "amber request"
            },
            "label": "amber request",
            "occurrenceKey": "dh3-003#request#1",
            "type": "Requirement"
          },
          {
            "entityId": "v3-003-e3",
            "evidence": {
              "endOffset": 49,
              "startOffset": 36,
              "text": "amber request"
            },
            "label": "amber request",
            "occurrenceKey": "dh3-003#request#2",
            "type": "Requirement"
          },
          {
            "entityId": "v3-003-e4",
            "evidence": {
              "endOffset": 71,
              "startOffset": 57,
              "text": "unsafe release"
            },
            "label": "unsafe release",
            "occurrenceKey": "dh3-003#release#1",
            "type": "Risk"
          }
        ],
        "quarantineCount": 0,
        "relations": [
          {
            "evidence": {
              "endOffset": 34,
              "startOffset": 0,
              "text": "Dune register tracks amber request"
            },
            "predicate": "tracks",
            "relationId": "v3-003-r1",
            "sourceEntityId": "v3-003-e1",
            "targetEntityId": "v3-003-e2",
            "triggerEvidence": {
              "endOffset": 20,
              "startOffset": 14,
              "text": "tracks"
            }
          },
          {
            "evidence": {
              "endOffset": 71,
              "startOffset": 36,
              "text": "amber request blocks unsafe release"
            },
            "predicate": "blocks",
            "relationId": "v3-003-r2",
            "sourceEntityId": "v3-003-e3",
            "targetEntityId": "v3-003-e4",
            "triggerEvidence": {
              "endOffset": 56,
              "startOffset": 50,
              "text": "blocks"
            }
          }
        ]
      }
    },
    {
      "caseId": "dh3-004",
      "expected": {
        "abstentionMode": "none",
        "abstentionReason": null,
        "entities": [
          {
            "entityId": "v3-004-e1",
            "evidence": {
              "endOffset": 9,
              "startOffset": 0,
              "text": "Elm brief"
            },
            "label": "Elm brief",
            "occurrenceKey": "dh3-004#brief#1",
            "type": "Document"
          },
          {
            "entityId": "v3-004-e2",
            "evidence": {
              "endOffset": 34,
              "startOffset": 19,
              "text": "quartz decision"
            },
            "label": "quartz decision",
            "occurrenceKey": "dh3-004#decision#1",
            "type": "Decision"
          },
          {
            "entityId": "v3-004-e3",
            "evidence": {
              "endOffset": 51,
              "startOffset": 36,
              "text": "quartz decision"
            },
            "label": "quartz decision",
            "occurrenceKey": "dh3-004#decision#2",
            "type": "Decision"
          },
          {
            "entityId": "v3-004-e4",
            "evidence": {
              "endOffset": 74,
              "startOffset": 61,
              "text": "launch permit"
            },
            "label": "launch permit",
            "occurrenceKey": "dh3-004#permit#1",
            "type": "Requirement"
          }
        ],
        "quarantineCount": 0,
        "relations": [
          {
            "evidence": {
              "endOffset": 34,
              "startOffset": 0,
              "text": "Elm brief contains quartz decision"
            },
            "predicate": "contains",
            "relationId": "v3-004-r1",
            "sourceEntityId": "v3-004-e1",
            "targetEntityId": "v3-004-e2",
            "triggerEvidence": {
              "endOffset": 18,
              "startOffset": 10,
              "text": "contains"
            }
          },
          {
            "evidence": {
              "endOffset": 74,
              "startOffset": 36,
              "text": "quartz decision supports launch permit"
            },
            "predicate": "supports",
            "relationId": "v3-004-r2",